,Company Name,Use,Country,Description,Url,Email,Founders,Found Date,t1,t2,t3,t4,t5,t6,t7
643,PurpleDocs," Electronic Health Record (EHR), Health Care, Information Technology, Personal Health, Software",India,"PurpleDocs is making healthcare data secure, analyzable and accessible to all healthcare stakeholders", www.purpledocs.com/ ,sales@purpledocs.com,2,"Sep 6, 2010",—,—,—,—,—,—,—
644,StartSe," Education, Higher Education, Information Technology, Internet",Brazil,StartSe is a startup ecosystem., www.startse.com ,atendimento@startse.com.br,2,2014,—,—,—,—,—,—,—
645,Ltd.," Consulting, Digital Media, Enterprise Applications, Information Technology, Legal, Robotics, Software",India,"IT services company focused on product engineering for start-ups, ISVs and crafting digital transformation solutions for enterprises", www.e-zest.net ,info@e-zest.net,1,"Aug 8, 2000",—,—,—,—,—,—,—
646,Generation," Education, Information Technology",United States,Galaxy Next Generation is a provider of hand-in-hand with educators to help them evolve teaching and learning in their Connected Classrooms., www.galaxynext.us/ ,info@galaxynext.us,—,—,—,—,—,—,—,—,—
647,Solutions," Information and Communications Technology (ICT), Information Services, Information Technology, SaaS, Software",United States,BayOne Solutions provides computer programming services., bayonesolutions.com/ ,info@bayonesolutions.com,—,"Jul 3, 2012",—,—,—,—,—,—,—
648,Commerce," Blockchain, Cryptocurrency, Information Technology",United States,The Chamber of Digital Commerce is the world’s leading trade association representing the digital asset and blockchain industry., digitalchamber.org ,info@digitalchamber.org,1,"Jul 1, 2014",—,—,—,—,—,—,—
649,Inc.," Cyber Security, Government, Information Technology, IT Management, Network Security, Security",South Korea,Genians reimagines NAC by Device Platform Intelligence to ensure the highest levels of security and IT operational efficiency., www.genians.com/ ,hello@genians.com,2,"Jan 7, 2005","Aug 2, 2017",—,—,—,—,—,—
650,Edutopia," Education, Information Technology",United States,"Edutopia, an online platform committed to improve the K-12 education system, updates best practices, classroom tips, and recommendations.", www.edutopia.org/ ,info@edutopia.org,—,1991,—,—,—,—,—,—,—
651,Noviscient," Banking, Financial Services, FinTech, Information Technology, Insurance, Machine Learning, Payments",Singapore,Noviscient, www.noviscient.com ,info@novicient.com,1,"Sep 1, 2016",—,—,—,—,—,—,—
652,Ltd.," CRM, Fleet Management, GPS, Information Technology, Location Based Services, Logistics, Transportation",India,"Asti Infotech offers customizable business solutions based on GPS, RFID, Bluetooth and NFC technologies.", www.astiinfotech.com/Home ,shanthala.ms@astiinfotech.com,1,"Feb 1, 2013",—,—,—,—,—,—,—
653,RYCOR," Apps, Billing, Education, Information Technology, Software",United States,Leading SaaS provider for business administration solutions exclusively for k-12 schools across North America., www.rycor.net/ ,info@rycorsoftware.com,—,2000,—,—,—,—,—,—,—
654,Inlogic," Education, Information Technology, Software",Denmark,Inlogic is a Microsoft based IT company that offers a fully automated user management system (UMS) solution for the education sector., www.inlogic.dk ,salg@inlogic.dk,—,"Jan 1, 2008",—,—,—,—,—,—,—
655,Corporation," Analytics, CRM, Health Care, Information Technology, Software",United States,ARMATURE provides data management products and services., www.armaturecorp.com/ ,—,—,2000,—,—,—,—,—,—,—
656,Qooco," Information Technology, Language Learning, Speech Recognition, Training",China,The Online Mobile Spoken Language Vocational Training Solution for the Hospitality Industry., hotel.qooco.com/ ,—,2,2010,—,—,—,—,—,—,—
657,Publishing," Education, Enterprise Software, Information Technology, Knowledge Management, Software",Ireland,"Knowledge management, enterprise training, eLearning", intuition.com ,info@intuition.com,—,1985,—,—,—,—,—,—,—
658,Academy," Education, Information Technology, Security",United States,Evolve is a Cyber Security Bootcamp that prepares individuals to enter the coveted and fast growing Information Security industry., www.evolveacademy.io ,info@evolveacademy.io,—,2016,—,—,—,—,—,—,—
659,DFKI," Information and Communications Technology (ICT), Information Technology",Germany,DFKI researched innovative software technologies and is working on solutions for the knowledge society ., www.dfki.de/web ,info@dfki.de,—,1988,—,—,—,—,—,—,1
660,HUE," Education, Information Technology",United States,"HUE - Colourful, affordable technology to inspire creative teaching and learning.", huehd.com/animation/ ,—,—,1994,—,—,—,—,—,—,—
661,LearnLaunch," EdTech, Education, Information Technology",United States,LearnLaunch aims to increase learning by providing support for the creation and growth of education technology and learning companies., learnlaunch.org/ ,info@learnlaunch.org,—,2012,—,—,—,—,—,—,—
662,Software," Association, Education, Government, Information Technology, Non Profit, Software",United States,"nFocus Software provides performance management, training, and outcome measurement software to the public sector.", www.nfocus.com ,Support@nFocus.com,—,1984,—,—,—,—,—,—,—
663,Novitex," Crowdfunding, EdTech, Enterprise, Information Technology, Software",United States,Novitex Enterprise Solutions is a global providers of transaction processing and enterprise information management solutions., www.novitex.com/industries/insurance ,marketing@novitex.com,—,2013,—,—,—,—,—,—,—
664,Ltd," CRM, Enterprise Applications, Enterprise Software, Information Services, Information Technology, Software",United States,NDOT provides innovative enterprise mobility solutions that focus on enhancing the core businesses of enterprises., www.ndot.in ,nandakumar@ndot.in,1,"May 28, 2008",—,—,—,—,—,—,—
665,Temple," Education, Information Technology, Software",United States,Educational Training Organization , codingtemple.com/ ,Info@codingtemple.com,1,"Dec 1, 2014",—,—,—,—,—,—,—
666,Garzotto," Education, Information Technology", — ,Andreas Garzotto GmbH is an independent company that offer services for information processin, www.garzotto.ch ,—,—,—,—,—,—,—,—,—,—
667,Interlace," Cloud Data Services, Information Technology, Software",India,Interlace is a provider of IT consulting services., www.interlaceindia.com ,sales@interlaceindia.com,—,2007,—,—,—,—,—,—,—
668,HealthConnect," Accounting, Education, Health Care, Information Technology, Training",United States,US HealthConnect provides education for healthcare professionals., www.ushealthconnect.com/ ,—,—,1999,—,—,—,—,—,—,—
669,Networks," Education, Enterprise Software, Information Technology, Innovation Management, SaaS, Social Entrepreneurship",United States,"The first comprehensive SaaS solution focused on connecting and engaging the various participants within an “innovation ecosystem.""", expertknowledgenetworksinc.com/ ,—,—,Mar 2016,—,—,—,—,—,—,—
670,Professionals," Government, Information Technology, Security, Software",United States,Vanguard Integrity provides enterprise security software and services that solve complex security and regulatory compliance challenges., www.go2vanguard.com/ ,info@go2vanguard.com,—,1986,—,—,—,—,—,—,—
671,Interactive," Consumer Electronics, Hardware, Information Technology, Software",United States,"Clear Touch Interactive provides streamlined, bundled hardware and software solutions for business and education. ", www.getcleartouch.com/ ,—,—,2012,—,—,—,—,—,—,—
672,That," Apps, EdTech, Enterprise Software, Information Technology, Mobile, Mobile Apps, Product Design, Social Media, Software",United States,Storyboards for software development, www.storyboardthat.com ,Feedback@storyboardthat.com,1,"Mar 1, 2012",—,—,—,—,—,—,—
673,Corporation," Advice, Association, Consulting, Corporate Training, Information Technology, Internet, Non Profit, Personal Development, Social Entrepreneurship, Social Media Marketing",Canada,DIA Earth Corporation is developing and networking leadership for the next generation., www.diaearthcorp.com ,MEGarySeto@diaearthcorp.com,1,"Mar 24, 2015",—,—,—,—,—,—,—
674,anynines," Cloud Data Services, Cloud Management, Consulting, Enterprise Applications, Information Technology, Software, Training",Germany,"anynines is a digital transformation company focused on planning, building and operating modern application developer platforms.", www.anynines.com ,contact@anynines.com,1,Nov 2008,—,—,—,—,—,—,—
675,Blockchain," Blockchain, EdTech, Information Services, Information Technology, Local, Professional Services",Brazil,OriginalMy is a regtech that makes decentralized authenticity using blockchain for issuing IDs and for notarizing and signing documents., originalmy.com ,contato@originalmy.com,1,"Jul 18, 2015",—,—,—,—,—,—,—
676,Solutions," Education, Information Technology, Mobile Apps, Parenting, Software",Canada,Appazur Solutions is a customized mobile app for schools to provide notifications and reminders from parents and students., www.appazur.com/ ,hello@appazur.com,1,2013,—,—,—,—,—,—,—
677,Inc.," Information Technology, Software, Telecommunications",United States,"Providing cost-effective, leading edge Unified Communications solutions for our customers and partners since 2004.", variphy.com/ ,info@variphy.com,—,"Jan 1, 2004",—,—,—,—,—,—,—
678,Alert," E-Learning, Information Technology, Real Time",United States,Driver's Alert provides an end-to-end fleet safety management solution., www.driversalert.com ,sales@driversalert.com,2,1989,"Feb 10, 2020",—,—,—,—,—,—
679,Technology," Electronics, Information Technology, Software",Taiwan,Digital signage solutions supplier, www.cayintech.com ,press@cayintech.com,—,2004,—,—,—,—,—,—,—
680,First," Education, Information Technology, Robotics, Software",United Kingdom,"Double First Engage provides the SMT, its teachers and its administrators with the systems needed to manage activity,", www.doublefirst.com/ ,—,—,1987,"Apr 6, 2020",—,—,—,—,—,—
681,PureLogics," Cloud Data Services, EdTech, Information Technology, Internet, Mobile Apps, Software, Web Development",United States,"PureLogics is a full service technology company that synchronizes people, processes and technology in the smartest way possible.", www.purelogics.net ,info@purelogics.net,3,"Jul 1, 2006",—,—,—,—,—,—,—
682,Research," Education, Information Services, Information Technology", — ,Institute for Infocomm Research's mission is to be the globally preferred source of innovations., www.i2r.a-star.edu.sg/ ,inddev@i2r.a-star.edu.sg,—,2002,—,—,—,—,—,—,—
683,Center," Biotechnology, Education, Government, Health Care, Information Technology, Life Science, Non Profit",Philippines,National Institutes of Health values engaging people to identify problems in the health care system., telehealth.ph/ ,—,—,1998,—,—,—,—,—,—,—
684,Control," Information Technology, Internet, Virtual Reality",United States,Ground Control is a single-source provider of professional grade satellite Internet services & VoIP telephone., groundcontrol.com ,sales@groundcontrol.com,1,2002,—,—,—,—,—,—,—
685,AS," Information Services, Information Technology, Robotics, Software, Training",Norway,Lingit provides multilingual literacy support for dyslexics., lingit.no/ ,lingit@lingit.no,1,2001,—,—,—,—,—,—,—
686,SuccessHacker," Consulting, CRM, Customer Service, Education, Information Technology, Management Consulting, Recruiting",United States,"SuccessHACKER is a customer success advisory firm focused on providing education, recruiting, and consulting service.", successhacker.co/ ,todd@successhacker.co,2,2014,—,—,—,—,—,—,—
687,Ciatech," Business Intelligence, Corporate Training, E-Learning, EdTech, Education, Information Technology",Brazil,Ciatech contributes to business results from various organizations offering complete solutions for e-learning., www.ciatech.com.br/ ,contact@ciatech.com.br,1,1996,—,—,—,—,—,—,—
688,Solutions," Business Intelligence, Information Services, Information Technology",United States,GreenZone Solutions is an SBA-certified small disadvantaged business and a woman-owned smallb business., greenzoneinc.com/ ,info@greenzoneinc.com,—,2010,—,—,—,—,—,—,—
689,SoluteLabs," Android, Education, Enterprise Software, Fitness, Information Technology, iOS, Software, Transportation, Web Development",India,SoluteLabs is a high-performance team focused on mobile and web design and development; we have produced top #10 chart topping apps!, www.solutelabs.com ,contactus@solutelabs.com,2,"Aug 26, 2014",—,—,—,—,—,—,—
690,Malaysia," Cyber Security, Government, Information Technology",Malaysia,"CyberSecurity Malaysia is the national cyber security specialist agency under the Ministry of Science, Technology and Innovation.", www.cybersecurity.my/ ,info@cybersecurity.my,—,1997,—,—,—,—,—,—,—
691,Biocompare," Biotechnology, CRM, Education, Information Technology, Internet, Internet of Things, Life Science, Publishing",United States,Online Buyer's Guide for Life Scientists., biocompare.com ,info@biocompare.com,—,2000,—,—,—,—,—,—,—
692,Play," Information Technology, Mobile, Venture Capital",United States,Plug and Play Tech Center is a startup accelerator specialized in technology companies., www.abrilplugandplay.com/ ,contato@abrilplugandplay.com,—,2014,—,—,—,—,—,—,—
693,Technology," Business Information Systems, Information Services, Information Technology, Software",United States,Escape Technology provides ERP software for K-12 schools., www.escape.technology/ ,support@escapetech.com,1,1985,—,—,—,—,—,—,—
694,Graffiti," Information Technology, Security",United States,"Virtual Graffiti is an IT solutions providers for business, government and education.", www.virtualgraffiti.com ,sales@virtualgraffiti.com,—,"Nov 1, 1999",—,—,—,—,—,—,—
695,Limited," Advertising, CRM, Information Technology, Marketing",India,Manipal Digital Systems is a leading premedia and end to end content solutions firm working across the , manipaldigital.info/ ,sales@manipalsystems.com,—,"Apr 7, 2007",—,—,—,—,—,—,—
696,ImaginXP," Information Technology, Training, UX Design",India,ImaginXP is a curriculum company with a focus on training and certification in UX Design and Design Thinking., www.imaginxp.com ,trainer@imaginxp.com,—,2013,—,—,—,—,—,—,—
697,Surgient," Enterprise Software, Information Technology, Software, Training",United States,"Surgient offers self-service virtualization, automation and lab management solutions.", www.surgient.com/ ,sales@surgient.com,—,1999,"Oct 2, 2010",—,—,—,—,—,—
698,QuickSchools.com," Cloud Computing, Education, Information Technology",United States,QuickSchools provides a modern cloud based student information system for K-12 schools, www.quickschools.com ,info@quickschools.com,2,"Jun 6, 2009",—,—,—,—,—,—,—
699,Chatroll," Advertising, Big Data, Blogging Platforms, Information Technology, Marketing, Messaging, Real Time, SaaS, Video",Canada,"Chatroll is a leading provider of cross-platform, real-time interactive solutions. Chatroll's live event platform enables organizations of", chatroll.com ,support@chatroll.com,—,2007,—,—,—,—,—,—,—
700,Associates," Information Technology, IT Infrastructure, IT Management, Network Hardware, Procurement, Staffing Agency",United States,"IT Services & Products for government, education, enterprise, small and medium-sized businesses, and non-profit organizations.", www.eatonassoc.com ,info@eatonassoc.com,—,1989,—,—,—,—,—,—,—
701,Technologies," Education, Information Technology",Israel,"Wizcomtech Ltd. is a pioneer and world leader in personal, portable, scanning dictionaries, reading Pens and scanning Pens.", wizcomtech.com/ ,facebook@wizcomtech.com,—,1995,—,—,—,—,—,—,—
702,LLC," Education, Information Technology",United States,ZaranTech is an information technology company specializing in online IT training and services., zarantech.com ,info@zarantech.com,—,2006,—,—,—,—,—,—,—
703,Establishment," Information Technology, Security",Canada,CSE is a national cryptologic agency that offers the Government of Canada with IT Security and foreign signals intelligence services., cse-cst.gc.ca/en ,media@cse-cst.gc.ca,—,"Jan 1, 1946",—,—,—,—,—,—,—
704,Observatory," Communities, Education, Information Technology, Satellite Communication",United States,The National Radio Astronomy Observatory is a facility of the National Science Foundation operated under cooperative agreement., www.nrao.edu/ ,—,—,1956,—,—,—,—,—,—,—
705,Digital," Consulting, Education, Information Technology, Software",Brazil,"Just Digital is specialized in consulting, implementation and training solutions, projects.", justdigital.com.br/ ,contato@justdigital.com.br,—,2008,—,—,—,—,—,—,—
706,Efficiencie," EdTech, Fleet Management, Information Technology, Internet of Things, Location Based Services, Software",Uganda,Efficiencie builds relevant and innovative technology solutions that empower people and businesses., www.efficiencie.com ,info@efficiencie.com,3,"Nov 16, 2013",—,—,—,—,—,—,—
707,Drive," Consulting, Information Technology, Public Safety, Risk Management, Training, Transportation",Brazil,CEPA Safe Drive specializes in risk control and management programs caused by traffic accidents., www.cepasafedrive.com/en/ ,cepamexico@cepasafedrive.com,—,1987,—,—,—,—,—,—,—
708,LikeAbird," Drones, Information Technology, Robotics, Software",Spain,Unmanned Systems & Robotics Related Company, www.likeabird.eu ,hq-office@likeabird-group.eu,1,Sep 2015,—,—,—,—,—,—,—
709,Institute," Education, Information Technology", — ,Trust Edge Leadership Institute is a Minnesota-based company that helps global leaders and organizations build trust., trustedge.com/ ,—,—,1999,—,—,—,—,—,—,—
710,Inc.," Consulting, Education, Energy Management, Information Technology, Project Management, Quality Assurance, Risk Management, Software, Sustainability, Training",United States,"ISO Management Systems support: documents, templates, manuals, procedures and webbased training solutions", c-bg.com/default.aspx ,info@cpd-ca.com,—,"Sep 1, 2005",—,—,—,—,—,—,—
711,Research," Health Care, Information Technology, Management Consulting",United States,Atlas Research is an award-winning consulting firm providing strategic advisory and applied research services., atlasresearch.us ,info@atlasresearch.us,—,2008,—,—,—,—,—,—,—
712,India," Association, EdTech, Education, Government, Information Technology",India,ERNET India is the National Research and Education Network dedicated to support the research and education community within the country., ernet.in ,info@eis.ernet.in,—,1998,—,—,—,—,—,—,—
713,Systems," Education, Government, Information Technology, Software",Canada,"Full Service Training Provider to Associations, Corporations and Government Agencies since 2", www.basecorp.com/ ,sales@skillbuilderlms.com,—,"Jan 1, 2001",—,—,—,—,—,—,—
714,Marketing," E-Learning, EdTech, Information Technology, Marketing",United Kingdom,S-cool Youth Marketing is a free resource dedicated to providing revision guides for students and teachers., www.s-cool.co.uk ,—,—,2000,—,—,—,—,—,—,—
715,JANA," Consulting, Education, Information Technology",United States,JANA is a writing and editing company specializing in technical documentation services., janacorp.com ,—,—,"Jan 1, 1973",—,—,—,—,—,—,—
716,LLC," Broadcasting, Government, GovTech, Information Technology, Internet, Politics, Software, Video Streaming",United States,"Swagit provides hands-free video streaming®, broadcast, and captioning solutions to local, state & federal government agencies.", swagit.com/ ,corporate@swagit.com,2,Sep 2003,—,—,—,—,—,—,—
717,Tech," Augmented Reality, Information Technology, Mobile",India,COITOR IT Tech organization based out of India focusing on delivering cutting edge products in augmented reality domain., coitor.com ,info@coitor.com,2,2013,—,—,—,—,—,—,—
718,Technologies," Education, Information Technology, iOS, Software",United States,SAPIEN Technologies has produced information technology and software solutions that make a difference., www.sapien.com/ ,info@sapien.com,—,1986,—,—,—,—,—,—,—
719,ICFO," Association, Biotechnology, Education, Information Technology", — ,"ICFO is a young, fast growing research institution that aims at advancing the limits of scientific and technological knowledge.", www.icfo.eu/ ,—,—,—,—,—,—,—,—,—,—
720,Systems," Consulting, Information Technology, Logistics, Supply Chain Management, Training",United States,"A systems integration firm with technology enhanced domain expertise in Logistics, Engineering, Acquisition, Maintenance and Training.", www.pd-sys.net/ ,busdev@pd-sys.net,1,2007,—,—,—,—,—,—,—
721,UHIN," Health Care, Information Technology",Hungary,"UHIN is a nonprofit coalition of healthcare providers payers, state government and other stakeholders ", uhin.org/ ,customerservice@uhin.org,—,1993,—,—,—,—,—,—,—
722,Alliance," Consulting, Higher Education, Information Technology",United States,Systems Alliance is a technology services firm, www.systemsalliance.com/ ,—,—,1993,—,—,—,—,—,—,—
723,T3K-Forensics," Consulting, Information Technology, Law Enforcement, Mobile, Software, Software Engineering, Training",Austria,Mobile Forensics, www.t3k-forensics.com ,office@t3k-forensics.com,1,"Sep 7, 2007",—,—,—,—,—,—,—
724,Inc.," Consumer Electronics, Information Technology, Software, Training",United States,"
Custom software solutions and epicor support.", www.precisonline.com ,—,—,"Mar 13, 1994",—,—,—,—,—,—,—
725,Dendreo," Apps, Developer Tools, Information Technology, Software, Training",France,Information System for training centers, www.dendreo.com ,contact@dendreo.com,2,"Aug 1, 2011",—,—,—,—,—,—,—
726,ESX," Information Technology, Software",United States,ESX is a full service software solutions company., www.esxinc.com/esx/default.asp ,info@esxinc.com,—,1999,—,—,—,—,—,—,—
727,Computing," Information Technology, Software",South Africa,Praxis is a black owned and managed software and IT services company that takes IT strategy into thoroughly practical implementation., www.praxis.co.za/ ,info@praxis.co.za,1,1993,—,—,—,—,—,—,—
728,District," Education, Events, Information Technology",The Netherlands,"Educational programs and events centred around new technologies and disruptive innovation, through collaboration with leading names in tech", binarydistrict.com ,support@binarydistrict.com,—,"Jan 1, 2017",—,—,—,—,—,—,—
729,Carehawk," Communications Infrastructure, Computer, Industrial, Information Technology, Robotics",United States,"CareHawk is a provider of life safety communications platforms for education, corrections, healthcare, and industrial facilities.", www.carehawk.com/ ,info@carehawkusa.com,—,2005,—,—,—,—,—,—,—
730,Chatwee," Communities, Digital Entertainment, Information Technology, Messaging, SaaS, Social Media, Software",United States,Chatwee is group chat software that provides real-time chatting experience for communities on websites., www.chatwee.com ,info@chatwee.com,—,2012,—,—,—,—,—,—,—
731,MSI," Information Technology, Training",France,"MSI provides solutions around the sale, installation, and maintenance of IT equipment.", www.msi-nord.fr ,marketing@msi-nord.fr,—,"Jan 2, 1985",—,—,—,—,—,—,—
732,Knowledge," Artificial Intelligence, Big Data, Information Technology, Legal, Machine Learning, Software",United States,Coherent Knowledge uses artificial intelligence (AI) and semantic technology to provide deep reasoning for knowledge management., coherentknowledge.com/ ,info@coherentknowledge.com,1,"Jul 18, 2013",—,—,—,—,—,—,—
733,Technologies," Government, Information Technology, Security, Software, Telecommunications",United States,"Catalyst is a technology innovator in Primary Dispatch, Back-up Dispatch, and Interoperability solutions based on Radio control over IP.", www.catcomtec.com/ ,—,—,1997,—,—,—,—,—,—,—
734,AppMonk," Apps, Education, Fitness, Health Care, Information Technology, Mobile Apps, Software",Denmark,AppMonk has a passion for people., www.appmonk.dk/ ,smile@appmonk.dk,—,"May 1, 2011",—,—,—,—,—,—,—
735,Consulting," Consulting, Corporate Training, Information Technology",Russian Federation,KORUS Consulting is an actively growing Russian systems integration company., korusconsulting.com/ ,info@korusconsulting.ru,—,2000,—,—,—,—,—,—,—
736,Ltd," Consulting, Education, Information Technology, Staffing Agency",India,RPS Consulting specializes in providing best technical training on all popular IT certifications., www.rpssoft.com ,info@rpssoft.com,1,2006,—,—,—,—,—,—,—
