,Company Name,Use,Country,Description,Url,Email,Founders,Found Date,t1,t2,t3,t4,t5,t6,t7
184,Out," Association, Communities, Education, Information Technology",United States,"Fostering diversity, equity, and inclusion through events, networking, and education", www.shegeeksout.com/ ,hello@shegeeksout.com,2,Mar 2015,—,—,—,—,—,—,—
185,FrogTutoring," Education, Information Technology, Online Portals",United States,Frog Tutoring is an educational technology platform that provides in-home tutoring., www.frogtutoring.com ,info@frogtutoring.com,1,"Nov 19, 2009",—,—,—,—,—,—,—
186,Group," Consulting, Education, Health Care, Information Technology",United States,"Providing industry-leading training programs, The Brooks Group is all about effective communications.", thebrooksgrouponline.com ,info@brooksgroupinc.biz,—,1994,—,—,—,—,—,—,—
187,Technologies," Android, Education, Information Technology, iOS, Mobile Apps, Software",India,"Web Trackker is a web solutions company that offers industrial training in java, dot net, php, sap, mobile apps, node.js, and more.", www.webtrackker.com/ ,info@webtrackker.com,—,"Mar 4, 2012",—,—,—,—,—,—,—
188,AllConnected," Education, Health Care, Information Technology, Medical",United States,"AllConnected, they help businesses, schools and healthcare organizations.", www.allconnected.com ,info@allconnected.com,—,1998,—,—,—,—,—,—,—
189,Group," Education, Financial Services, FinTech, Information Technology, Insurance, Internet",United States,"ISRG’s mission is to reduce financial, technological, and education barriers to secure communication over the Internet.", letsencrypt.org/isrg ,—,—,—,—,—,—,—,—,—,—
190,Nekonata," Artificial Intelligence, Automotive, Autonomous Vehicles, Education, Enterprise Software, Information Technology, Machine Learning, Railroad, Software Engineering",Austria,"Using XR Technology,  NEKONATA unites human driving behaviour with machine intelligence for safer automated driving systems.", www.nekonata.at ,contact@nekonata.at,2,"Sep 15, 2017",—,—,—,—,—,—,—
191,Specialists," Cloud Computing, Cloud Infrastructure, Consulting, Information Services, Information Technology, IT Management, Network Security, SaaS",Australia,Enhancing Business Through Technology, cloudspecialists.net.au ,info@cloudspecialists.net.au,—,"Dec 18, 2013",—,—,—,—,—,—,—
192,Group," Consulting, Education, Information Technology, Real Estate, Staffing Agency",United States,Safety Management Group is a construction company specializing in safety staffing and training services., safetymanagementgroup.com ,—,—,1990,—,—,—,—,—,—,—
193,Modulant," Information Technology, Retail, Software",United States,"Modulant is a IT services & solutions company specializing in Data Management, Systems Integration, Software Development and IT Staffing.", www.modulant.com/ ,—,—,1989,—,—,—,—,—,—,—
194,Ireland," Communications Infrastructure, Information Technology, IT Infrastructure, Telecommunications",Ireland,Bt Ireland is a global provider of communications solutions and IT services company located in Dublin., btireland.net ,—,—,1989,—,—,—,—,—,—,—
195,Services," Education, Information Technology",United States,IOR Global Services is a professional training company specializing in global mobility services., iorworld.com ,—,—,"Jan 1, 1979",—,—,—,—,—,—,—
196,Solutions," Education, Enterprise Software, Information Services, Information Technology, Software, Telecommunications", — ,The WorkPlace Solutions GmbH has emerged as a university spin-off company. On Workspace Software Engineering at the University of Hamburg, www.wps.de ,info@wps.de,—,1950,—,—,—,—,—,—,—
197,Ltd.," Finance, Information Technology, Publishing",United Kingdom,"WELCOME TO AGORA MEDIA... We are a Blockchain Media publishing company located in London, England", www.agoramedia.co.uk ,richard@agoramedia.co.uk,1,"Nov 1, 2009",—,—,—,—,—,—,—
198,LearnerNation," Education, Enterprise Software, Information Technology, Software",United States,Beautifully Simple Educational Software, LearnerNation.com ,Hello@LearnerNation.com,—,2012,—,—,—,—,—,—,—
199,LIMITED," Education, Government, Information Technology",Hong Kong,A company supported by government-owned HKSTP's Incubation Program focusing on Education and Living related Technology busuinesses, www.censpothk.com ,—,—,Oct 2014,—,—,—,—,—,—,—
200,InterDev, Information Technology,United States,"InterDev provides professional Information Technology (IT) services and support to government, education, business.", www.interdev.com/ ,info@InterDev.com,1,"May 1, 1980",—,—,—,—,—,—,—
201,Leadership," Consulting, CRM, Education, Information Technology",United States,Partners In Leadership is the leading accountability training consulting and training firm., www.partnersinleadership.com/ ,contact@partnersinleadership.com,—,1989,—,—,—,—,—,—,—
202,Conferencing," Data Integration, Information Services, Information Technology, Public Relations, Video Conferencing",United States,"Video conferencing, a/v integration", www.solutionzinc.com ,kmcclune@solutionzinc.com,—,"Jun 1, 2001",—,—,—,—,—,—,—
203,Avocor," Education, Electronics, Information Technology, Software",United Kingdom,"Avocor are a global leader in collaborative solutions, creating world-class interactive solutions for the workplace and classroom.", www.avocor.com/ ,info@avocor.co.uk,—,2016,—,—,—,—,—,—,—
204,Systems," Computer, Education, Information Technology, SaaS, Software",United States,"Gyrus Systems is a US-based, SAAS Learning Management System (LMS) provider.", www.gyrus.com ,sales@gyrus.com,1,"Oct 1, 1987",—,—,—,—,—,—,—
205,Systems," Computer, Information Technology, Logistics, Software, Transportation",Norway,APX Systems a systems integrator building turnkey solutions with our scalable in-house developed software., www.apx-systems.com/ ,companymail@apx-systems.com,1,"Jan 1, 1992",—,—,—,—,—,—,—
206,99cloud," Cloud Infrastructure, Consulting, Information Technology, Training",China,"99Cloud is an OpenStack-based solutions and operations company based in Shanghai, China.", 99cloud.net/en/ ,—,1,2012,—,—,—,—,—,—,—
207,Internet2," Developer Platform, Education, Identity Management, Information Technology, Internet, Social Network, Software",United States,Internet2 is a collaboration of many U.S.-based universities to develop networking and advanced applications for learning and research., www.internet2.edu ,—,—,1996,—,—,—,—,—,—,—
208,OpenIAM," Architecture, Hospitality, Information Technology, Training",United States,OpenIAM provides the most comprehensive Identity and Access Management solution based on a professional open source model., www.openiam.com ,sales@openiam.com,—,2008,—,—,—,—,—,—,—
209,Wavetec, Information Technology,United Arab Emirates,Wavetec has a unique capability of providing customized solutions to its clients to match their needs accurately., wavetec.com ,info@wavetec.com,—,1986,—,—,—,—,—,—,—
210,Learning," Education, Information Technology",United States,"NetCom Learning offers innovative educational solutions to individual, government and corporate clients.", www.netcomlearning.com ,marketing@netcomlearning.com,—,1998,—,—,—,—,—,—,—
211,Ltd.," Consulting, Education, Information Technology, Legal, Robotics, Software",India,Nice Software Solutions Pvt. Ltd. is an information technology company offering BI consulting and educational services., nicesoftwaresolutions.com ,info@nicesoftwaresolutions.com,—,2008,—,—,—,—,—,—,—
212,Software," Enterprise Software, Information Technology, SaaS, Software",United States,Cloud-based Association Management, www.acgisoftware.com ,sales@acgisoftware.com,2,1996,—,—,—,—,—,—,—
213,One," Consulting, Content, Government, Information Technology, Internet, Non Profit, Open Source, Software, Web Development",United States,Forum One is a digital agency that focuses on driving progress on issues of importance for public sector organizations., forumone.com/ ,info@forumone.com,—,1996,—,—,—,—,—,—,—
214,Scheduler," Banking, Government, Higher Education, Information Technology, Non Profit, Retail, SaaS, Software, Wellness",United States,SUMO Scheduler is built 100% native on Salesforce and does the heavy lifting of appointment scheduling for enterprise organizations., www.sumoscheduler.com/ ,experts@SumoScheduler.com,1,"Jan 1, 2015",—,—,—,—,—,—,—
215,Interactive," Augmented Reality, Consulting, Information Technology, Software, Training, Virtual Reality",United States,"DI specializes in creating augmented reality, adaptive training.", designinteractive.net ,contact@designinteractive.net,—,1998,—,—,—,—,—,—,—
216,Zenva," Apps, Education, Information Technology, Software, Tutoring",Australia,Leading online academy to learn programming and game development, www.zenva.com ,pablofarias@zenva.com,1,2012,—,—,—,—,—,—,—
217,Eclypses," Cyber Security, Information Technology, Robotics",United States,"Eclypses was developed by Secure Cloud Systems, Inc. for an ""Internet of Things"".", www.eclypses.com/ ,—,—,"Jan 1, 2017",—,—,—,—,—,—,—
218,Ltd," Information Technology, Oil and Gas, Training",India,"SmartBrains Engineers & Technologist Pvt. Ltd is a Leading Training Institute of Oil and gas, Piping design , Mechanical and Electrical .", smartbrains.in ,mail.smartbrains@gmail.com,—,"Jan 1, 1998",—,—,—,—,—,—,—
219,Amida," Cyber Security, Health Care, Information Technology, Software",United States,Amida concentrates on data and data security., amida-tech.com ,contact@amida-tech.com,2,"Jun 1, 2013",—,—,—,—,—,—,—
220,Lanteria," E-Learning, Enterprise Software, Human Resources, Information Technology, SaaS, Software",United States,Lanteria is a collaborative and customizable Human Capital Management platform for SharePoint and Office 365., www.lanteria.com ,info@lanteria.com,—,2006,—,—,—,—,—,—,—
221,Inc.," Information Services, Information Technology, Internet, Language Learning",United States,"Curiosity Media Inc. is a product company that builds websites that delight, entertain and educate people from around the world.", www.curiositymedia.com ,—,—,2005,—,—,—,—,—,—,—
222,RED," CRM, EdTech, Education, Higher Education, Information Technology, Software",United States,"Fire Engine RED is an innovative technology, marketing, and modeling solutions company that’s served the education market since 2001.", fire-engine-red.com/ ,info@fire-engine-red.com,—,2001,—,—,—,—,—,—,—
223,Lane, Information Technology,United States,"Fast Lane is the leading, worldwide provider of advanced IT education for Cisco, NetApp, VMware, Microsoft.", www.fastlaneus.com/ ,info@fastlane.pl,—,—,—,—,—,—,—,—,—
224,Nostra," Cloud Data Services, Finance, Information Technology, Security",Ireland,Nostra is an IT Service Provider and Business IT Company operating in Ireland and the UK., www.nostra.ie ,info@nostra.ie,—,2006,—,—,—,—,—,—,—
225,Solutions," Education, Information Technology, Software",United States,"Meridian Knowledge Solutions is the leading provider of enterprise, web-based learning management software.", www.meridianks.com ,meridiansales@meridianks.com,—,1997,—,—,—,—,—,—,—
226,Group," Consulting, Information Technology, Internet, Internet of Things, Robotics, Software",United States,OpenNMS® Horizon is the world’s first enterprise grade network management platform published under the open source model., www.opennms.com/ ,sales@opennms.com,—,2004,"Jul 27, 2020",—,—,—,—,—,—
227,FABRIC," Education, Information Technology",United Kingdom,Integrated solutions for higher education, fullfabric.com ,hello@fullfabric.com,—,2012,—,—,—,—,—,—,—
228,Plan," Cycling, Fitness, Information Technology, Software, Sports, Training",Australia,Today’s Plan is smarter training for every cyclist., www.todaysplan.com.au ,info@todaysplan.com.au,—,"Dec 1, 2014",Sep 2019,—,—,—,—,—,—
229,Mawi," E-Learning, Education, Information Technology, Internet",United States,Mawi Learning unlocks student and educator potential through research-based online courses., www.mawilearning.com/ ,—,1,1999,"Jun 25, 2019",—,—,—,—,—,—
230,Exponent," Consulting, CRM, Education, Information Technology, SaaS, Software",United States,Exponent helps nonprofits use information technology to carry out their missions more efficiently and effectively., www.exponentpartners.com/ ,info@exponentpartners.com,1,2005,—,—,—,—,—,—,—
231,BITKOM," Digital Media, Information Technology, Internet, IT Infrastructure, Telecommunications",Germany,"BITKOM is the voice of the IT, telecommunications and new media industry.", www.bitkom.org ,bitkom@bitkom.org,—,1999,—,—,—,—,—,—,—
232,Systems," Information Technology, Software",United States,Feith Systems creates class-leading business process management., www.feith.com ,more-info@feith.com,—,1979,—,—,—,—,—,—,—
233,Consulting," Commercial, Consulting, Government, Health Care, Higher Education, Information Technology, Software",United States,LSI Consulting is a computer software company providing SAP systems., www.lsiconsulting.com ,sales@lsiconsulting.com,—,1998,—,—,—,—,—,—,—
234,HMB," Information Services, Information Technology",United States,HMB is a service-based company that offers IT and technology solutions for medium to large companies in various industries., www.hmbnet.com/ ,sales@hmbnet.com,—,1994,—,—,—,—,—,—,—
235,Technology, Information Technology,United States,"ABS offers expertise in Structured Cabling, Networking, Colla, HW + SW, Cloud, Managed Services, Security, LifeCycle Services and Staffing.
", www.abstechnology.com ,hello@abstechnology.com,—,1972,"Aug 26, 2019",—,—,—,—,—,—
236,Zoan," Information Technology, Real Estate, Software, Travel",Finland,Produces high quality 3D modeling in a cost-effective way, zoan.fi/ ,info@zoan.fi,1,2010,—,—,—,—,—,—,—
237,Surveys," Information Technology, Software",United States,Snap Surveys provides survey software and feedback management solutions., www.snapsurveys.com ,sales@snapsurveys.com,—,1981,—,—,—,—,—,—,—
238,Consulting," Consulting, Information Technology, Lead Generation, Marketing, Training",United States,Skaled is a modern sales-consulting firm that helps startup and established companies scale more efficiently., skaled.com ,info@skaled.com,1,"Dec 12, 2012",—,—,—,—,—,—,—
239,Design," Information Services, Information Technology",United States,ASD® provides a single point of contact for the design & project management for Division 27 & 28 of the CSI., www.asd-usa.com/ ,sales@asd-usa.com,—,1987,—,—,—,—,—,—,—
240,Screenpresso," Image Recognition, Information Technology, Motion Capture, Photo Sharing, Software, Training",France,Screenpresso screen capture allows you to grab an image or video of what you see on your computer screen., www.screenpresso.com/ ,contact@screenpresso.com,—,"Jan 1, 2012",—,—,—,—,—,—,—
241,Rivers," Consumer Applications, EdTech, Health Care, Information Technology, mHealth, Mobile, Mobile Apps, Software, Software Engineering, Web Development",United States,"Technology Rivers is a custom software development company (Web, Mobile, Wearables, Cloud, Desktop) Apps, Product Development, MVP, Startups", technologyrivers.com ,info@technologyrivers.com,1,2002,—,—,—,—,—,—,—
242,Science," Chemical, Education, Health Care, Higher Education, Information Technology, Life Science, Medical, Publishing",United Arab Emirates,"Bentham Science Publishers is a publishing company of scientific, technical, and medical literature based in Sharjah.", benthamscience.com/ ,marketing@benthamscience.org,—,1992,—,—,—,—,—,—,—
243,Computers," Hardware, Information Technology, Software",United States,"Sterling Computers Corporation is an IT sales and services company, provides technology solutions to government and education customers.", www.sterlingcomputers.com/ ,info@sterlingcomputers.com,—,1996,—,—,—,—,—,—,—
244,Digital," Information Services, Information Technology",Belgium,EIT Digital is a  European digital innovation and entrepreneurial education organisation., www.eitdigital.eu ,info@eitdigital.eu,—,2010,—,—,—,—,—,—,—
245,Neovation," Information Technology, Software, Training",Canada,Neovation is a research and development company focused on delivering innovative software., neovation.com/ ,info@neovation.com,—,2012,—,—,—,—,—,—,—
246,CannaSOS," Cannabis, Cryptocurrency, Fitness, Health Care, Information Technology, Wellness",Canada,"CannaSOS offers a social web platform to explore, rate, and review the medical aspects of cannabis.", cannasos.com ,investment@cannasos.com,—,"Jul 1, 2014",—,—,—,—,—,—,—
247,TutoTOONS," Apps, Art, Education, Information Technology",Spain,Free drag & drop mobile game builder that lets you create games without coding, tutotoons.com/ ,support@tutotoons.com,—,"Jun 1, 2013",—,—,—,—,—,—,—
248,ImageSpike," Advertising, Education, Information Technology, Internet",Canada,"ImageSpike is a suite of tools that allow users to add social, collaborative, and interactive capabilities to photos.", www.imagespike.com ,invest@emmaactive.com,—,2010,—,—,—,—,—,—,—
249,Inc.," Consulting, Information Technology, Software, Staffing Agency",United States,"Rangam promotes inclusive employment for everyone, including individuals with autism and disabilities as well as disabled veterans.", rangam.com/ ,staffing@rangam.com,2,1995,—,—,—,—,—,—,—
250,CrossBraining," Education, Information Technology, SaaS",United States,"CrossBraining is a competency-as-a-Service (CaaS) video software platform for K-20, vocational, and corporate learning.", www.crossbraining.com ,sales@crossbraining.com,1,2017,—,—,—,—,—,—,—
251,Engines," Analytics, Data Visualization, Information Technology, Real Time, Software",United Kingdom,Analytics Engines provides customers with fast and efficient processing of business and application data., analyticsengines.com ,info@analyticsengines.com,1,2008,—,—,—,—,—,—,—
252,CYBERNETIQ," Consulting, Cyber Security, Information Technology, Infrastructure, Real Time, Security, Software",Canada,CybernetIQ is a growing Canadian software development team focused on the development of innovative products., cybernetiq.ca ,—,1,"Jun 9, 2007",—,—,—,—,—,—,—
253,Lablup," Cloud Computing, Information Technology, Machine Learning, SaaS, Software",South Korea,Lablup is developing technologies for distributed computing for machine learning researches and applications., www.lablup.com/ ,—,3,May 2015,—,—,—,—,—,—,—
254,Birdhouse," EdTech, Health Care, Information Technology",United States,Birdhouse is a social enterprise that provides care coordination technology for developmental disabilities & chronic conditions communities., www.birdhousehq.com ,ben@birdhousehq.com,3,2012,—,—,—,—,—,—,—
255,Solutions," Health Care, Information Technology",United States,PayRight Health Solutions provides patient education and payment processing services for healthcare providers., payrighthealth.com ,—,2,2010,—,—,—,—,—,—,—
256,Developers," Education, Information Technology, Marketing, Sales",United States,Sales Technology and Enablement, www.thesalesdevelopers.com ,Ryan@thesalesdevelopers.com,2,"Apr 1, 2018",—,—,—,—,—,—,—
257,CirrusWorks," Computer, Information Technology, IT Management",United States,"CirrusWorks is a developer of customer management software for childcare, community learning, and education industries.", www.cirrusworks.net/ ,info@cirrusworks.net,2,2011,—,—,—,—,—,—,—
258,Amigo," Education, Fitness, Health Care, Human Resources, Information Technology",United States,Training Amigo is a corporate wellness company providing customizable cloud based software and wellness solutions for your business., www.trainingamigo.com ,nathan@trainingamigo.com,1,"Dec 1, 2013",—,—,—,—,—,—,—
259,People," Education, Information Technology",United Kingdom,They deliver high quality and effective IT and project management courses; we are here to help you succeed., www.learningpeople.co.uk/ ,enquiries@learningpeople.co.uk,1,2010,—,—,—,—,—,—,—
260,Proximie," Artificial Intelligence, Augmented Reality, Education, Health Care, Information Services, Information Technology, Machine Learning, Medical, Software, Telecommunications",United Kingdom,We save lives by sharing the world’s best clinical practice., www.proximie.com/ ,info@proximie.com,2,2016,—,—,—,—,—,—,—
261,DocDelta," Data Integration, Database, Health Care, Hospital, Information Technology, Medical",United States,"DocDelta is a comprehensive, sales, marketing and recruiting platform with the best in class healthcare business data. ", www.docdelta.com/ ,info@docdelta.com,3,Jun 2015,—,—,—,—,—,—,—
262,Nicolette," Health Care, Information Services, Information Technology, Medical",United States,Nicolette operates as a patient empowerment company., nicolette.com ,—,3,"Jan 1, 2016",—,—,—,—,—,—,—
263,Group," Analytics, Enterprise Software, Information Technology, SaaS, Software, Video",United States,"Gorilla Technology Group, Inc. is an independent software solution and SaaS provider that specializes in Video technology and Analytics.", www.gorilla-technology.com/ ,sales.americas@gorilla-technology.com,1,"May 17, 2001",—,—,—,—,—,—,—
264,Foundry," Association, Communities, EdTech, Education, Higher Education, Information Technology, Messaging",Norway,"Makers of Differ, a messaging app with chatbot teaching assistants. 19x increased student engagement. 3x increased course completion rates.", www.differ.chat/ ,kristian@differ.chat,2,"Jan 1, 2015",—,—,—,—,—,—,—
265,Digitability," Digital Marketing, Information Technology, Marketing",United States,"Digitability teaches marketable, digital life skills to promote independence for students in a technology driven society and economy.", digitability.com/ ,—,1,2011,—,—,—,—,—,—,—
266,Us," EdTech, Education, Information Technology",United Kingdom,"Technology Will Save Us is a technology startup that offers DIY gadget kits, activities, and online resources for children.", www.techwillsaveus.com/ ,info@techwillsaveus.com,2,2012,—,—,—,—,—,—,—
267,CourseNetworking," Career Planning, CRM, EdTech, Education, Information Technology, MOOC, Social Media, Software",United States,CourseNetworking offers cloud-based learning tools and services for massive open online courses (MOOC) and classroom-based courses., www.thecn.com/ ,info@thecn.com,1,2011,—,—,—,—,—,—,—
268,Technologies," Artificial Intelligence, Education, Information Technology, Machine Learning",Norway,"Anzyz is an Artificial Intelligence company, which uniquely integrates supervised, unsupervised and manual rule based learning.", www.anzyz.com/ ,contact@anzyz.com,1,"Jan 1, 2014",—,—,—,—,—,—,—
269,CampusESP," Higher Education, Information Services, Information Technology, Social Media",United States,CampusESP helps build your engagement strategy for the modern parent., www.campusesp.com/ ,info@CampusESP.com,2,Jan 2015,—,—,—,—,—,—,—
270,GBooking," Information Services, Information Technology, Small and Medium Businesses, Software",Israel,GBooking is an appointment scheduling and resource optimization system designed especially for service companies., gbooking.biz ,info@gbooking.ru,2,2011,—,—,—,—,—,—,—
271,Technologies," E-Learning, Enterprise Software, Information Technology, Software",United States,Monarch Teaching Technologies offers software for the treatment of children with autism and other communication disorders., www.monarchtt.com ,info@monarchtt.com,1,"May 14, 2005",—,—,—,—,—,—,—
272,Inc.," Education, Information Technology, Internet, Software",United States,Our visual patent drafting interface enables users to easily disclose their ideas and automatically generate patent applications., www.patentdive.com/ ,—,1,"Dec 1, 2013",—,—,—,—,—,—,—
273,Africa," Banking, Education, Finance, Financial Services, FinTech, Information Technology, Productivity Tools",Kenya,Cherehani leverages technology to provide credit bundled with market information and financial education to women micro-entrepreneurs., cherehani.org/ ,info@cherehani.org,3,"Feb 2, 2015",—,—,—,—,—,—,—
274,Systems," Data Center, Information Technology, Software",United States,"Rozo Systems develops RozoFS, a High Performance and High Resilient Software Defined Scale Out NAS", www.rozosystems.com ,info@rozosystems.com,1,"Jul 27, 2010",—,—,—,—,—,—,—
275,Docola," Education, Health Care, Information Technology",United States,Docola is a digital health platform enabling providers to support patients with information & education throughout the care continuum, www.doco.la ,—,3,"Sep 5, 2013",—,—,—,—,—,—,—
276,WeTipp," Apps, Information Services, Information Technology",United Kingdom,WeTipp is the online platform that connects through interests and skills to help groups engage their members., wetipp.com/ ,info@wetipp.com,2,2012,—,—,—,—,—,—,—
