,Company Name,Use,Country,Description,Url,Email,Founders,Found Date,t1,t2,t3,t4,t5,t6,t7
371,Alliance," Association, Communities, Consulting, Education, Information Technology, Legal, Venture Capital",Canada,"WEtech’s vision is to build a regional technology community that fosters entrepreneurship, innovation.", www.wetech-alliance.com/ ,info@wetech-alliance.com,—,2009,—,—,—,—,—,—,—
372,Code," Health Care, Information Technology, Medical",United States,"Find A Code provides medical coding professionals from clinics, insurance companies, and education.", www.findacode.com ,info@findacode.com,—,"Feb 1, 2005",—,—,—,—,—,—,—
373,Knowbility," Association, Consulting, Education, Government, Information Technology, Internet, Non Profit",United States,An Austin-based national nonprofit corporation that delivers a broad range of technical., www.knowbility.org ,atstar@knowbility.org,—,1999,—,—,—,—,—,—,—
374,Consulting," Consulting, Education, Information Technology",United States,"Colonial Consulting is a provider of investment consulting services in manager searches,donor forums and educational forums.", www.colonialconsulting.com ,—,—,1980,—,—,—,—,—,—,—
375,CoBlue," Education, Human Resources, Information Technology",Brazil,CoBlue helps companies improve their alignment by implementing the OKR methodology through training and provides a platform to manage it., coblue.com.br/ ,contato@coblue.com,—,"May 23, 2014",—,—,—,—,—,—,—
376,EffortlessOffice," Cloud Computing, Education, Information Technology",United States,"Effortless offers an enterprise-class, all-in-one cloud environment with solutions for security, desktops, disaster recovery, servers.", www.effortlessoffice.com ,cbridge@effortlessoffice.com,—,2012,—,—,—,—,—,—,—
377,Projects," Banking, Financial Services, FinTech, Information Technology",Nigeria,"Parkway is a leading financial technology provider creating modern banking experiences, proudly developed by Africans.", www.parkwayprojects.com ,info@parkwayprojects.com,1,Apr 2004,—,—,—,—,—,—,—
378,Hub, Information Technology,Zambia,"Innovation generally refers to the creation or improvement of products, technologies.", bongohive.co.zm/ ,contactus@bongohive.com,1,2011,—,—,—,—,—,—,—
379,Ltd.," E-Learning, Graphic Design, Information Technology, Publishing, Software, Video",India,"We deliver services and solution through four operating group: custom e-learning development, web development, pre-press & video production.", corecompetency.net/ ,support@corecompetency.net,1,"Nov 23, 2003",—,—,—,—,—,—,—
380,Technologies," 3D Technology, Augmented Reality, Information Services, Information Technology",China,Vanguard in immersive 3D content technologies, www.oppentech.com/en ,bd@oppentech.com,1,"Jun 6, 2016",—,—,—,—,—,—,—
381,i3-Technologies," Education, Information Technology, Software",Belgium,i3-Technologies is a global company that offers interactive solutions to learning and meeting environments., www.i3-technologies.com ,service@i3-technologies.com,—,2013,—,—,—,—,—,—,—
382,GoDigital," CRM, Education, Financial Services, FinTech, Information Technology, Insurance",Philippines,GoDigital is a service-based financial technology company primarily focusing on contactless card payments and online wallet., godigitalcorp.com/ ,inquiry@godigitalcorp.com,1,"Sep 1, 2016",—,—,—,—,—,—,—
383,Knowrom," Information Technology, Internet, Photo Sharing, Social Media, Video",Czech Republic,"Knowrom is a free site to share information on universities through reviews, photos, videos, questions and answers and student events in", www.knowrom.com ,info@knowrom.com,1,"Jul 1, 2012",—,—,—,—,—,—,—
384,AXErunners," Banking, Blockchain, Communications Infrastructure, Cryptocurrency, Education, Financial Services, Information Technology, Mining, Payments, Security",United States,Decentralized blockchain, axerunners.com ,info@axerunners.com,1,2017,—,—,—,—,—,—,—
385,Tyfoom," Information and Communications Technology (ICT), Information Technology, Mobile, Software, Training",United States,"Tyfoom is a productivity, training, and communication platform developing rockstar employees on the simplest mobile training platform.", www.tyfoom.com/ ,customercare@tyfoom.com,1,2017,—,—,—,—,—,—,—
386,Robotics," Education, Health Care, Information Technology, Robotics",Hong Kong,Rehab-Robotics Company is award-winning R&D medical device robotic company based in Hong Kong., rehab-robotics.com/ ,info@rehab-robotics.com,—,2008,—,—,—,—,—,—,—
387,-," Education, Information Technology",The Netherlands,Together with our ToolsHeroes we’re building a library for tomorrow., www.toolshero.com ,info@toolshero.com,—,"Jul 1, 2013",—,—,—,—,—,—,—
388,Billigence, Information Technology,Australia,"Billigence provides business intelligence solutions. Headquartered in Sydney, Australia.", billigence.com ,—,—,—,—,—,—,—,—,—,—
389,Group," Information Services, Information Technology",New Zealand,OSS Group is one of New Zealand’s leading I.T. consulting and solutions companies., oss-group.co.nz/ ,info@oss-group.co.nz,—,2008,—,—,—,—,—,—,—
390,QIRIS," Biotechnology, Education, Information Technology, Non Profit",Italy,"QIRIS is a non-profit organization devoted to scientific research, innovation & technology, and to building entrepreneurial ecosystems", www.qiris.org ,info@qiris.org,—,"Mar 5, 2009",—,—,—,—,—,—,—
391,VerbaVoice," Android, Apps, Education, Information Technology, iOS, Mobile, Video",Germany,"To help hearing impaired people through the use of modern technologies like, equal access to knowledge, information.", www.verbavoice.de ,info@verbavoice.de,—,2009,—,—,—,—,—,—,—
392,Inc.," Education, Information Technology",United States,"ALTA Language Services is a translation company offering training, testing, and accent reduction services.", altalang.com ,dford@altalang.com,—,1980,—,—,—,—,—,—,—
393,Solutions," Government, Health Care, Hospital, Information Technology, Software",United States,ISS Solutions is a provider of customized technology lifecycle management solutions., www.isssolutions.com ,issinfo@isssolutions.com,—,1971,—,—,—,—,—,—,—
394,IYSERT," Education, Electric Vehicle, Energy, Energy Storage, Information Technology, Manufacturing, Product Research, Renewable Energy, Solar, Wind Energy",India,IYSERT is India's Top Energy Research and Development Company with having World Class manufacturing Facility in Rajasthan, iysertenergy.com/ ,iysertindia@gmail.com,1,"Jul 13, 2016",—,—,—,—,—,—,—
395,Corporation," Cloud Computing, Information Technology, Service Industry, Software, Telecommunications",Vietnam,"Lac Viet Computing Corporation, a leading IT services provider for small and medium sized companies in Vietnam.", www.lacviet.vn/ ,lacviet@lacviet.com.vn,—,1994,—,—,—,—,—,—,—
396,Ltd," E-Commerce, Education, Information Technology, Real Estate, Software, Web Development",India,"Specialist with Software development, Mobile App development, Web development, Web design and Internet marketing.", www.tekkiwebsolutions.com/ ,projects@tekkiwebsolutions.com,—,"Mar 16, 2010",—,—,—,—,—,—,—
397,Inc.," Cloud Storage, Cyber Security, Hardware, Information Technology, SaaS, Security, Video Streaming",United States,"Complete Cloud Video Surveillance (VSaaS) for Commercial, Education and Government Customers.", viaas.com ,info@viaas.com,—,2017,—,—,—,—,—,—,—
398,Simula," Artificial Intelligence, Information Technology, Machine Learning, Software",Norway,"Simula is a research laboratory that provides R&D regarding software engineering, machine learning, education and artificial intelligence.", www.simula.no/ ,post@simula.no,—,"Jan 1, 2001",—,—,—,—,—,—,—
399,Amtelco," Call Center, Information Technology, Software, Telecommunications",United States,Amtelco is a telecommunications company specializing in call center software., amtelco.com ,info@amtelco.com,—,1976,—,—,—,—,—,—,—
400,Soft," Government, Information Technology, Security, Software, Virtual Reality",United States,"I Monitor Soft is an employee computer monitoring software designed for enterprises, education organizations, and government offices.", www.imonitorsoft.com ,Sales@imonitorsoft.com,—,"Aug 10, 2002",—,—,—,—,—,—,—
401,UkrInSofT," Apps, Consulting, E-Commerce, Education, Information Services, Information Technology, Internet, Mobile, Real Estate",Ukraine,UkrInSofT - is a software agency that specializes in Web & Mobile app development and Cyber Security solutions., ukrinsoft.com ,mfrasolyak@ukrinsoft.com,3,"Oct 14, 2006",—,—,—,—,—,—,—
402,Jokkolabs," Association, Communities, Coworking, Education, Information Services, Information Technology",Senegal,"Jokkolabs is a unique environment where entrepreneurs, creatives and innovators can develop their business quickly.", jokkolabs.net/ ,hellodakar@jokkolabs.net,1,2010,—,—,—,—,—,—,—
403,Mobiliza," Career Planning, Corporate Training, E-Learning, Education, Enterprise Software, Human Resources, Information Technology, Internet, Robotics, SaaS, Software",Brazil,Mobiliza helps companies to drastically improve corporate tranning. Mostly through the Applique Bundle., www.mobiliza.com.br ,conexao@mobiliza.com.br,2,2004,—,—,—,—,—,—,—
404,Love," Education, Information Technology", — ,"At code(love), They believe the future will be decided by well-rounded technical entrepreneurs.", www.code-love.com/ ,info@code-love.com,—,—,—,—,—,—,—,—,—
405,UK," Consulting, Education, Information Technology, Social Entrepreneurship, Training",United Kingdom,The Alacrity Foundation assists young engineering and business graduates in building technology companies., www.alacrityfoundation.co.uk ,contact@alacrityfoundation.com,1,"Sep 3, 2012",—,—,—,—,—,—,—
406,Solutions," Education, Information Technology, Robotics, Software",United States,Firestorm Solutions is a company that specializes in teaching crisis management to schools and businesses., www.firestorm.com ,facebook@firestorm.com,2,2005,—,—,—,—,—,—,—
407,Academy," Education, Information Technology, Security",United States,"Online Cyber security training school, providing quality infosec education. A marketplace for cyber security instructor and students.", academy.ehacking.net ,support@ehacking.net,—,"Nov 4, 2015",—,—,—,—,—,—,—
408,Learning," E-Learning, Education, Information Technology",United States,"Founded by educators and gamers, Second Avenue Learning provides custom development and managed services to education technology clients.", secondavenuelearning.com/ ,info@SecondAvenueLearning.com,—,2006,—,—,—,—,—,—,—
409,Technology," Advertising, Consulting, Information Technology, IT Management, SEO, Software, Training, Web Design, Web Development",India,Empowerment Technology is a SEO company that offers web design and development and IT training services., empowermenttech.com ,arvind@empowermenttech.com,—,"Jan 5, 2012",—,—,—,—,—,—,—
410,Ltd.," Education, Information Technology, Software",India,"DS Digital’s product range comprises of Digital Classrooms, Tablet Solution, Hands On Labs, Language Lab and Teacher Trainings.", www.dsdigital.in ,info@dsdigital.in,—,2009,—,—,—,—,—,—,—
411,Models," Child Care, Children, Education, Information Technology",United Kingdom,Role Models provide Creative Childcare for children in London and Life Skills Courses in the UK and Internationally, www.rolemodels.me ,info@rolemodels.me,1,"Aug 1, 2013",—,—,—,—,—,—,—
412,CHROMEIS," Cloud Computing, Corporate Training, Information Technology, Mobile Apps, Professional Services, Quality Assurance, Usability Testing, Web Hosting",Pakistan,CHROMEIS PVT LTD is a Microsoft partner and ISO 9001:2015 certified company., chromeis.com ,info@chromeis.com,1,"Sep 28, 2015",—,—,—,—,—,—,—
413,FeverBee," Communities, Consulting, Education, Information Technology, Legal", — ,"FeverBee provides consultancy, training, and technology to help you build your community.", www.feverbee.com/ ,hello@feverbee.com,1,2010,—,—,—,—,—,—,—
414,360, Information Technology,United States,Emergent is an award winning IT Solutions Provider., www.emergent360.com/ ,sales@emergent360.com,—,2006,—,—,—,—,—,—,—
415,Solutions," Education, Information Technology",United States,Ambassador Education Solutions is an education management company providing content integration programs and bookstore solutions., ambassadored.com ,info@ambassadored.com,—,1973,—,—,—,—,—,—,—
416,Techvedic," Business Development, Business Intelligence, Consulting, E-Commerce, Hardware, Information and Communications Technology (ICT), Information Services, Information Technology",United States,Techvedic provides customer support and enterprise CRM solutions., www.techvedic.com ,contact@techvedic.com,1,"Oct 23, 2009",—,—,—,—,—,—,—
417,examio," E-Learning, Education, Higher Education, Information Technology, Universities",Germany,"examio is an e-learning platform providing online-courses, exam-courses and webinars for high school, academic and professional education.", www.examio.de ,kontakt@examio.de,—,"Oct 1, 2012",—,—,—,—,—,—,—
418,LTD," Education, Information Technology, Language Learning, Location Based Services, Translation Service",United Kingdom,Global Language Solution is a professional language translation services company. We provide Document Translation Services., www.translate-document.com ,contact@translate-document.com,1,"Apr 15, 2017",—,—,—,—,—,—,—
419,Ltd," Consulting, Education, Information Technology, Legal",India,"Quality Growth Services Pvt. Ltd is leading DFSS, BCM and Six Sigma Training and Consultants Organisation.Get all solutions and query.", www.qgspl.com/ ,marketing@qgspl.com,—,"Mar 18, 2014",—,—,—,—,—,—,—
420,ELB," Information Technology, Software",United States,"A leading global integrated solutions provider specializing in visual collaboration,  and audio visual products and services.", www.electroboard.com/ ,sales@elbglobal.com,—,1986,—,—,—,—,—,—,—
421,GovNet," Education, Events, Government, Information Technology",United Kingdom,"Since 1997, GovNet has consistently delivered innovative, thought-provoking and insightful events.", www.govnet.co.uk/ ,—,—,1997,—,—,—,—,—,—,—
422,Unowhy," E-Learning, Information Services, Information Technology, Mobile",France,UNOWHY aims at unlocking the power of digital for everyone with 2 products : SQOOL (EdTech) and QOOQ (FoodTech), www.unowhy.com ,contact@unowhy.com,3,2007,—,—,—,—,—,—,—
423,Robots," Education, Information Technology, Robotics, Software, Virtual Reality", — ,Online distributor of personal robots and robotics technologies, www.generationrobots.com/en/ ,contact@generationrobots.com,—,"Jun 24, 2008",—,—,—,—,—,—,—
424,Codify," Information Technology, Software, Training, Web Development",United Kingdom,"Codify is a software development company that specializes in HSEQ, business management, training & specialist engineering applications.", www.codify.ltd.uk/ ,info@codify.ltd.uk,—,"Jan 1, 2000",—,—,—,—,—,—,—
425,ATGWORK," Analytics, Consulting, Information Technology, Software",United States,"ATGWORK is a computer software company offering Oracle consultancy, training, staffing, and support services", atgwork.com ,info@atgwork.com,1,1994,—,—,—,—,—,—,—
426,Insights," Business Development, Human Resources, Information Technology, Internet, Retail, Shopping, Software, Training",United States,Zappos Insights is a department within the Zappos Family of Companies created simply to help share the Zappos Culture with the world., www.zapposinsights.com/ ,support@zapposinsights.com,—,2014,—,—,—,—,—,—,—
427,Augusoft," Cyber Security, Education, Information Technology, Security, Software",United States,Augusoft is a provider of online enrollment and registration management software., www.augusoft.net ,marketing@augusoft.net,—,1994,—,—,—,—,—,—,—
428,Commerce," Association, Consulting, Government, Information Technology, Non Profit",Singapore,"The SGC is the one and only platform, and first to be contacted institution for German – Singaporean business relations.", www.sgc.org.sg/ ,info@sgc.org.sg,—,2004,—,—,—,—,—,—,—
429,Insights," Health Care, Information Technology, Medical",Switzerland,Medical Insights transforms the access to medical knowledge., www.insights.md ,—,—,2012,—,—,—,—,—,—,—
430,Networks," CRM, Education, Information Technology, Telecommunications",Indonesia,Biznet is a business entity that focus on telecom & multimedia business., www.biznetnetworks.com/ ,corporate_communication@biznetnetworks.com,—,2000,—,—,—,—,—,—,—
431,IT, Information Technology,United States,Apex IT is a global application systems integrator and implementation consultancy working with Oracle., www.apexit.com/ ,info@apexit.com,—,1997,—,—,—,—,—,—,—
432,Inc.," Consulting, Education, Government, Human Resources, Information Technology",United States,FPMI Solutions is a human resources company that offers human resources and learning services., fpmi.com ,info@fpmi.com,—,1985,—,—,—,—,—,—,—
433,One," Information Technology, Marine Transportation, Software",Singapore,Innovez One is an IT consultancy firm specialising in software technology solutions., www.innovez-one.com ,support@innovez-one.com,—,2004,—,—,—,—,—,—,—
434,Salepoint," Education, Health Care, Information Technology, Retail",United States,"Salepoint is a provider of business solutions to the retail point of sale, corporate retail, higher education, healthcare and public sector.", www.salepoint.com ,info@salepoint.com,1,1987,—,—,—,—,—,—,—
435,Services," Consulting, Education, Information Technology",United States,Propio Language Services is a translation company that provides interpretation services., propio-ls.com ,info@propio-ls.com,—,"Jun 1, 1998",—,—,—,—,—,—,—
436,Industries," EdTech, Education, Information Technology, Universities",United States,"Net Industries is a provider of high-quality, free educational web sites as well as free utilities for webmasters.", www.netindustries.us ,contact@netindustries.us,—,2002,—,—,—,—,—,—,—
437,Inc.," Advertising, Information Technology, Internet, Marketing",United States,Aware Web Solutions is an internet company providing marketing and technology engagement solutions., awareweb.com ,info@awareweb.com,—,1998,"Sep 11, 2019",—,—,—,—,—,—
438,Innovation," Analytics, CRM, Education, Information Technology, Machine Learning, Software",United States,Crowdsourcing - Automation - Machine Learning - Talent Management, www.CollectiveInnovation.com ,—,—,"Nov 1, 2015",—,—,—,—,—,—,—
439,eSchoolView," E-Learning, EdTech, Education, Information Services, Information Technology, SaaS, Software",United States,Makes website management accessible and easy for all schools through our responsive content management system with integrated web solutions., www.eschoolview.com ,info@eschoolview.com,2,2008,—,—,—,—,—,—,—
440,Group," Consumer Electronics, Cyber Security, Education, Information Services, Information Technology, Security, Software",United States,Computer Logic Group is a premier provider of PowerSchool© hosting solution, computerlogicgroup.com/ ,—,—,1988,—,—,—,—,—,—,—
441,Consulting," Consulting, Information Technology, Training",Germany,GAMBIT Consulting is an innovative SAP management consultancy that offers effective solutions for large and medium-sized companies., www.gambit.de ,info@gambit.de,—,"Jan 1, 1995",—,—,—,—,—,—,—
442,Perview," Human Resources, Information Technology, Recruiting, Skill Assessment, Software",Germany,HR Performance and Talent Management!, www.perview.de/ ,he.antz@vision-values.de,—,2002,—,—,—,—,—,—,—
443,Hosting," Information Technology, Web Hosting",United States,ICC Global Hosting - A Leading Provider of Innovative Technology Solutions Since 1983., iccgh.com/ ,sales@iccgh.com,—,1983,—,—,—,—,—,—,—
444,Software," Human Resources, Information Technology, Messaging, Mobile, Nightclubs, Recruiting, Software, Training",Jordan,Total hospitality software solutions, www.skyits.com ,info@skyits.com,—,"Nov 1, 1997",—,—,—,—,—,—,—
445,NRI," Consulting, Financial Services, Information Technology, Insurance", — ,S2NRI is one point solution for all NRI queries., www.services2nri.com ,s2nri.master@gmail.com,—,Dec 2013,—,—,—,—,—,—,—
446,Institute," Big Data, Consulting, Education, Information Technology",United States,"The Work Institute provide research studies, data analysis, reporting and consulting to help organizations.", workinstitute.com ,—,—,2000,—,—,—,—,—,—,—
447,H2kinfosys," Consulting, Information Technology, Software, Training",United States,Qatraininginusa.com is a placeholder of H2kinfosys that to provide job oriented IT Online Training across the world., www.qatraininginusa.com/ ,trainingandjob@qatraininginusa.com,1,"Apr 11, 2005",—,—,—,—,—,—,—
448,Corporation," Automotive, Consumer Electronics, Education, Electronics, Information Technology, Manufacturing",United States,"Midé Technology delivers smart technology products for the aerospace, marine, automotive, research, and manufacturing industries.", www.mide.com ,dmanion@mide.com,—,1989,—,—,—,—,—,—,—
449,Biztech," Information Technology, Service Industry, Training",United States,"Helps technology-based companies gain access to mentors, group experiences, training, shared space, professional assistance, and capital", www.biztech.org/ ,receptionist@biztech.org,—,"Apr 1, 1997",—,—,—,—,—,—,—
450,Empowerly," Education, Higher Education, Information Technology, Internet, Universities",United States,Empowerly is a platform for personalized college and career guidance, www.empowerly.com ,admin@empowerly.com,1,2016,—,—,—,—,—,—,—
451,STRIVR," Corporate Training, Enterprise, Enterprise Software, Information Technology, Software, Training, Virtual Reality",United States,"STRIVR is an information technology company that specializes in virtual reality, customer experience, and athlete performance.", www.strivr.com ,info@strivr.com,3,Jan 2015,—,—,—,—,—,—,—
452,CarDekho," Automotive, E-Commerce, Information Services, Information Technology, Software",India,CarDekho is working to digitize the auto ecosystem in India., www.cardekho.com/ ,contact@cardekho.com,2,2007,—,—,—,—,—,—,—
453,Applause," EdTech, Education, Freelance, Information Technology, Mobile, Software, Test and Measurement",United States,Applause is a crowd-sourced digital quality testing enabling companies to deliver digital experiences to their customers., www.applause.com ,delight@applause.com,2,Aug 2007,"Aug 23, 2017",—,—,—,—,—,—
454,Solutions," Education, Government, Health Care, Information Technology, Manufacturing, SaaS, Software",United States,"Dude Solutions is the leading provider of SaaS operations software for education, government, healthcare and membership-based organizations.", dudesolutions.com ,—,2,1999,"May 3, 2019",—,—,—,—,—,—
455,eloomi," Application Performance Management, Compliance, Corporate Training, E-Learning, Education, Human Resources, Information Technology, SaaS, Software",Denmark,eloomi is a software tool that simplifies training and people development in corporates., eloomi.com/ ,info@eloomi.com,2,"Apr 1, 2015",—,—,—,—,—,—,—
456,Codility," Big Data, Consulting, Employment, Human Resources, Information Technology, Internet, Recruiting, SaaS, Skill Assessment, Software",United Kingdom,"Codility is a SaaS platform that helps tech recruiters and hiring managers engage, recruit, and train stronger engineers, faster.", www.codility.com ,sales@codility.com,2,2009,—,—,—,—,—,—,—
457,Klaxoon," Collaboration, E-Learning, EdTech, Information Services, Information Technology",France,Klaxoon is a platform that develops collective intelligence and engagement everywhere people work together. , klaxoon.com/ ,contact@klaxoon.com,1,"Dec 23, 2014",—,—,—,—,—,—,—
458,Actimo," Collaboration, Enterprise Software, Information Technology, Messaging, SaaS, Training, Unified Communications, Video",Denmark,"Actimo is an easy-to-use communication and engagement platform to reach, train, and manage the workforce on mobile.", www.actimo.com ,info@actimo.com,3,2012,"Sep 16, 2020",—,—,—,—,—,—
459,IronScales," Information Services, Information Technology, SaaS, Software, Training",Israel,"IronScales is a SaaS solution that trains employees to spot, avoid, and mitigate undergoing spear-phishing attacks.", ironscales.com ,contact@ironscales.com,1,2014,—,—,—,—,—,—,—
460,Soundtrap," EdTech, Information Technology, Music, Music Education",Sweden,"Soundtrap operates an online music recording studio that enables users to record, edit, collaborate, and share their recordings.", www.soundtrap.com ,info@soundtrap.com,4,"Apr 1, 2012","Nov 17, 2017",—,—,—,—,—,—
